<?xml version="1.0" encoding="UTF-8"?>
<roaml
    xmlns:xsi="http://www.w3.org/2001/XMLSchema-instance"
    xsi:noNamespaceSchemaLocation="../../../data-format-specifications/RoAML-XML/main.xsd">

    <mc_parameters>
        <max_time value="40" unit="s" />
        <bt_tick_rate value="5.0" />
        <bt_tick_if_not_running value="true" />
    </mc_parameters>

    <behavior_tree>
        <input type="bt.cpp-xml" src="./bt_policies/policy.xml" />
        <input type="bt-plugin-ascxml" src="./bt_plugins/bt_perform_docking_maneuver.scxml" />
        <input type="bt-plugin-ascxml" src="./bt_plugins/bt_simple_wait.scxml" />
        <input type="bt-plugin-ascxml" src="./bt_plugins/bt_is_charging.scxml" />
        <input type="bt-plugin-ascxml" src="./bt_plugins/bt_reset_bumper_state.scxml" />
        <input type="bt-plugin-ascxml" src="./bt_plugins/bt_back_up.scxml" />
        <input type="bt-plugin-ascxml" src="./bt_plugins/bt_is_bump_detected.scxml" />
    </behavior_tree>

    <node_models>
        <input type="node-ascxml" src="./nodes/robot_model.scxml" />
    </node_models>

    <properties>
        <input type="jani" src="./properties/properties.jani" />
    </properties>
</roaml>
